{
  "$schema": "https://json-schema.org/draft/2020-12/schema",
  "$id": "https://github.com/reearth/okibi/spec/schema/tile-demand-event.schema.json",
  "title": "tile-demand event",
  "description": "One event per tile request. See spec/tile-demand.md; a binding decides where these land.",
  "type": "object",
  "properties": {
    "tile.service": {
      "type": "string",
      "minLength": 1
    },
    "tile.tileset": {
      "type": "string",
      "minLength": 1
    },
    "tile.kind": {
      "enum": [
        "content",
        "tileset",
        "subtree",
        "meta"
      ]
    },
    "tile.id": {
      "type": "string",
      "minLength": 1
    },
    "tile.qk": {
      "type": "string",
      "pattern": "^[0-3]*$"
    },
    "tile.qk8": {
      "type": "string",
      "pattern": "^[0-3]{0,8}$"
    },
    "tile.cache.status": {
      "enum": [
        "hit",
        "miss",
        "swr",
        "error"
      ]
    },
    "tile.cache.layer": {
      "description": "Which layer answered a hit. `edge` and `store` are registered; a service with another names it. Absent on a miss, which was answered by generating.",
      "type": "string",
      "minLength": 1
    },
    "tile.epoch.source": {
      "type": "string"
    },
    "tile.epoch.algo": {
      "type": "string"
    },
    "tile.epoch.param": {
      "type": "string"
    },
    "tile.fmt": {
      "type": "string",
      "minLength": 1
    },
    "tile.colo": {
      "type": "string"
    },
    "tile.site": {
      "description": "Which site asked, as a bare origin such as https://example.org. Empty where the client sent neither Origin nor Referer.",
      "type": "string"
    },
    "tile.origin": {
      "enum": [
        "organic",
        "warm"
      ]
    },
    "tile.count": {
      "description": "How many requests this event stands for: 1, or the weight k when a writer kept this organic hit as one in k.",
      "type": "integer",
      "minimum": 1
    },
    "tile.gen_ms": {
      "type": "number",
      "minimum": 0
    },
    "tile.gen_dep_ms": {
      "type": "number",
      "minimum": 0
    },
    "tile.bytes": {
      "type": "number",
      "minimum": 0
    },
    "tile.z": {
      "type": "number"
    }
  },
  "required": [
    "tile.service",
    "tile.tileset",
    "tile.kind",
    "tile.id",
    "tile.cache.status",
    "tile.fmt",
    "tile.origin",
    "tile.count",
    "tile.gen_ms",
    "tile.bytes"
  ],
  "additionalProperties": false,
  "allOf": [
    {
      "$comment": "An epoch is a part of the cache key. A service whose key has two parts names two; one with no epoch at all could never be matched to an invalidation, and its events would aggregate into a cell no plan can act on.",
      "anyOf": [
        {
          "properties": {
            "tile.epoch.source": {
              "minLength": 1
            }
          },
          "required": [
            "tile.epoch.source"
          ]
        },
        {
          "properties": {
            "tile.epoch.algo": {
              "minLength": 1
            }
          },
          "required": [
            "tile.epoch.algo"
          ]
        },
        {
          "properties": {
            "tile.epoch.param": {
              "minLength": 1
            }
          },
          "required": [
            "tile.epoch.param"
          ]
        }
      ]
    },
    {
      "$comment": "A content request has coordinates, so the spatial keys and the zoom are not optional there.",
      "if": {
        "properties": {
          "tile.kind": {
            "const": "content"
          }
        },
        "required": [
          "tile.kind"
        ]
      },
      "then": {
        "required": [
          "tile.qk",
          "tile.qk8",
          "tile.z"
        ],
        "properties": {
          "tile.qk": {
            "minLength": 1
          },
          "tile.qk8": {
            "minLength": 1
          }
        }
      }
    },
    {
      "$comment": "A hit generated nothing, so it cannot have spent time generating.",
      "if": {
        "properties": {
          "tile.cache.status": {
            "const": "hit"
          }
        },
        "required": [
          "tile.cache.status"
        ]
      },
      "then": {
        "properties": {
          "tile.gen_ms": {
            "const": 0
          }
        }
      }
    },
    {
      "$comment": "A miss was answered by generating, so no layer answered it.",
      "if": {
        "properties": {
          "tile.cache.status": {
            "const": "miss"
          }
        },
        "required": [
          "tile.cache.status"
        ]
      },
      "then": {
        "not": {
          "required": [
            "tile.cache.layer"
          ]
        }
      }
    },
    {
      "$comment": "Only an organic hit is ever sampled, so only an organic hit may stand for more than itself. A miss carries the generation time cost statistics need one for one, and a warm event is how okibi audits its own traffic.",
      "if": {
        "not": {
          "properties": {
            "tile.cache.status": {
              "const": "hit"
            },
            "tile.origin": {
              "const": "organic"
            }
          },
          "required": [
            "tile.cache.status",
            "tile.origin"
          ]
        }
      },
      "then": {
        "properties": {
          "tile.count": {
            "const": 1
          }
        }
      }
    }
  ]
}
