{
  "tile.service": "terrain",
  "tile.tileset": "cesium-mesh/ellipsoid",
  "tile.kind": "content",
  "tile.id": "14/29108/11439",
  "tile.qk": "13300211231032",
  "tile.qk8": "13300211",
  "tile.cache.status": "miss",
  "tile.epoch.source": "gsi-dem-2026a",
  "tile.epoch.algo": "tc-0.9.2",
  "tile.epoch.param": "me1.0-wm",
  "tile.fmt": "qmesh",
  "tile.colo": "NRT",
  "tile.origin": "organic",
  "tile.count": 1,
  "tile.gen_ms": 2380,
  "tile.bytes": 41200,
  "tile.z": 14
}
